[
  {
    "id": "CH-01",
    "title": "Local Budget Explorer",
    "problem": "City budgets are public but hard for residents to read.",
    "user": "Ana, a parent who wants to know why her neighborhood playground has no repairs.",
    "why_it_matters": "Public money becomes less accountable when the documents are unreadable.",
    "possible_data_sources": ["city budget PDFs", "open-data portals", "council budget annexes", "procurement datasets"],
    "mvp_scope": "Upload or link budget files, extract categories, show plain-language summaries, search by neighborhood or theme.",
    "difficulty": "Medium",
    "workflow_cards": ["WF-06", "WF-10", "WF-12"],
    "demo_examples": ["Ask how much is planned for parks and show the source-linked answer."],
    "continuation_path": "Publish cleaned tables, add year comparison, recruit finance mentor."
  },
  {
    "id": "CH-02",
    "title": "Public Services Navigator",
    "problem": "Residents cannot easily find the right office, form, fee, and next step for basic services.",
    "user": "Mihai, a new resident trying to register an address change.",
    "why_it_matters": "Confusing service paths waste time and punish people with less administrative knowledge.",
    "possible_data_sources": ["municipality service pages", "PDFs", "phone lists", "office hours", "local FAQ pages"],
    "mvp_scope": "Searchable guide with step-by-step answers and source citations.",
    "difficulty": "Easy",
    "workflow_cards": ["WF-01", "WF-02", "WF-10"],
    "demo_examples": ["Type a service need and get required documents, office, fee, and caveats."],
    "continuation_path": "Validate top 20 services with municipal staff."
  },
  {
    "id": "CH-03",
    "title": "FOIA Request Generator",
    "problem": "Citizens often do not know how to ask for public information in a legally useful way.",
    "user": "Elena, a local resident asking for contract documents about road repairs.",
    "why_it_matters": "Public information rights are weak if only specialists can use them.",
    "possible_data_sources": ["FOIA law text", "city contact pages", "prior request examples", "NGO guides"],
    "mvp_scope": "Guided form that produces a precise request, subject line, and delivery checklist.",
    "difficulty": "Easy",
    "workflow_cards": ["WF-01", "WF-09", "WF-10"],
    "demo_examples": ["Generate a request for procurement documents and show legal basis."],
    "continuation_path": "Add jurisdiction packs and response tracker."
  },
  {
    "id": "CH-04",
    "title": "Council Decisions Explainer",
    "problem": "Council decisions are published in dense documents that residents rarely understand in time to react.",
    "user": "Radu, a neighborhood association member tracking zoning decisions.",
    "why_it_matters": "Local democracy is weaker when decisions are technically public but practically hidden.",
    "possible_data_sources": ["council agenda PDFs", "decision archives", "meeting minutes", "zoning maps"],
    "mvp_scope": "Extract recent decisions, summarize what changed, who is affected, and where to verify.",
    "difficulty": "Medium",
    "workflow_cards": ["WF-06", "WF-10", "WF-11"],
    "demo_examples": ["Paste a decision PDF and produce a resident-facing brief."],
    "continuation_path": "Subscription alerts by topic or neighborhood."
  },
  {
    "id": "CH-05",
    "title": "Public Procurement Watcher",
    "problem": "Procurement notices and awards are scattered, technical, and hard to watch over time.",
    "user": "Ioana, a local journalist following repeated awards to the same supplier.",
    "why_it_matters": "Procurement is where public money becomes real power.",
    "possible_data_sources": ["national procurement portals", "city contracts", "budget annexes", "company registries"],
    "mvp_scope": "Track a small category, summarize new awards, flag repeat suppliers or unusual changes.",
    "difficulty": "Hard",
    "workflow_cards": ["WF-06", "WF-10", "WF-03"],
    "demo_examples": ["Show supplier timeline for one procurement category."],
    "continuation_path": "Add human review workflow and publish methodology."
  },
  {
    "id": "CH-06",
    "title": "Civic Issue Map",
    "problem": "Local complaints are spread across social media, forms, and informal channels.",
    "user": "Sorin, a neighborhood volunteer collecting broken sidewalk reports.",
    "why_it_matters": "Patterns stay invisible when complaints remain isolated.",
    "possible_data_sources": ["public reports", "open maps", "photos submitted by participants", "existing issue lists"],
    "mvp_scope": "Map issues, cluster by type, generate status notes, export CSV.",
    "difficulty": "Medium",
    "workflow_cards": ["WF-01", "WF-02", "WF-11"],
    "demo_examples": ["Add five reports and show clustered neighborhood problems."],
    "continuation_path": "Integrate with existing civic reporting groups."
  },
  {
    "id": "CH-07",
    "title": "School Rights Assistant",
    "problem": "Parents and students struggle to understand school rights, procedures, and complaint paths.",
    "user": "Maria, a high-school student asking what to do about an unfair disciplinary decision.",
    "why_it_matters": "Rights that cannot be understood are rights that cannot be used.",
    "possible_data_sources": ["education law", "school regulations", "inspectorate pages", "NGO explainers"],
    "mvp_scope": "Question-and-answer guide with source links, plain-language caveats, and escalation paths.",
    "difficulty": "Medium",
    "workflow_cards": ["WF-10", "WF-11", "WF-12"],
    "demo_examples": ["Ask about a school procedure and get a cited answer."],
    "continuation_path": "Legal review, youth testing, translated versions."
  },
  {
    "id": "CH-08",
    "title": "NGO Admin Copilot",
    "problem": "Small NGOs lose time on repetitive reporting, grant, and volunteer admin.",
    "user": "Cristina, an NGO coordinator preparing a funder report after work hours.",
    "why_it_matters": "Civic groups burn out when admin eats the time meant for public work.",
    "possible_data_sources": ["anonymized reports", "grant templates", "activity logs", "public annual reports"],
    "mvp_scope": "Generate report drafts from structured notes, checklist missing info, export Markdown.",
    "difficulty": "Easy",
    "workflow_cards": ["WF-01", "WF-09", "WF-10"],
    "demo_examples": ["Turn activity notes into a report draft with missing fields marked."],
    "continuation_path": "Template library by funder type."
  },
  {
    "id": "CH-09",
    "title": "Local Journalism Research Assistant",
    "problem": "Local reporters need fast help reading documents, timelines, and public records.",
    "user": "Andrei, a local reporter checking claims in a council debate.",
    "why_it_matters": "Local journalism has too much document work and too little time.",
    "possible_data_sources": ["council minutes", "procurement portals", "court portals", "public statements", "archives"],
    "mvp_scope": "Source notebook that summarizes documents, extracts entities, and tracks citations.",
    "difficulty": "Hard",
    "workflow_cards": ["WF-06", "WF-10", "WF-03"],
    "demo_examples": ["Upload three documents and generate a timeline with source links."],
    "continuation_path": "Newsroom pilot with strict verification rules."
  },
  {
    "id": "CH-10",
    "title": "PDF-to-Open-Data Converter",
    "problem": "Public information is often trapped in scanned or messy PDFs.",
    "user": "Daria, a civic data volunteer turning permit lists into reusable tables.",
    "why_it_matters": "Open data does not exist when the only source is a locked PDF.",
    "possible_data_sources": ["local PDFs", "scanned tables", "annual reports", "annexes", "meeting packs"],
    "mvp_scope": "Upload PDF, extract tables, let humans correct fields, export CSV and JSON.",
    "difficulty": "Medium",
    "workflow_cards": ["WF-06", "WF-10", "WF-12"],
    "demo_examples": ["Convert a council annex into a cleaned table with correction log."],
    "continuation_path": "Publish conversion recipes and validation tests."
  }
]

